{
  "billStatus": "Paid",
  "paymentType": "Ach",
  "billingAccount": "AK000000009",
  "billId": 26875,
  "totalAmount": 737.09,
  "currentAmount": 15,
  "previousAmount": 706.5,
  "previousInterestAmount": 0.59,
  "previousPenaltyAmount": 0,
  "previousLateFeeAmount": 15,
  "paidBy": "a@s.com",
 
  "dueDate": "04/30/2019",
  "createdDate": "2019-03-10T22:35:08.405+0000",
  "updatedDate": "2019-04-10T22:35:08.405+0000",
  "billItems": [
    {
      "manifestTrackingNumber": "0000123458ELC",
      "amount": 5,
      "submissionType": "FullElectronic",
      "originType": "Web",
      "certifiedDate": "03/30/2019",
      "generatorSiteId": "MD00000003"
    }
  ],
  "lateFees": [
    {
      "lateFeeBillId": 23421,
      "interestAmount": 0.59,
      "penaltyAmount": 0,
      "lateFeeAmount": 15.59,
      "flatFeeAmount":15,
      "status":"Active",
      "createdDate": "2019-03-10T22:35:08.405+0000"
    }
  ],
  "revisions": [
    {
      "adjustmentAmount": 10,
      "amountType": "Current",
      "adjustmentType": "Increase",
      "publicComments": "credit",
      "createdDate": "2019-03-10T22:35:08.405+0000"
    }
  ]
}